<!-- Board description files

     Copyright (c) 2007-2012 Mentor Graphics Corporation.

     THIS FILE CONTAINS PROPRIETARY, CONFIDENTIAL, AND TRADE
     SECRET INFORMATION OF MENTOR GRAPHICS AND/OR ITS LICENSORS.

     You may not use or distribute this file without the express
     written permission of Mentor Graphics or its authorized
     distributor.  This file is licensed only for use with 
     Sourcery CodeBench.  No other use is permitted.
     -->

<!ELEMENT board
	(category?, properties?, feature?, initialize?, memory-map?, debuggerDefaults?)>

<!-- Board category to group boards list into the tree -->
<!ELEMENT category (#PCDATA)>

<!ELEMENT properties
	(description?, property*)>

<!ELEMENT initialize
	(write-register | write-memory | delay
	 | wait-until-memory-equal | wait-until-memory-not-equal)* >
<!ELEMENT write-register EMPTY>
<!ATTLIST write-register
		        address CDATA   #REQUIRED
                        value   CDATA   #REQUIRED
                        bits    CDATA   #IMPLIED>
<!ELEMENT write-memory EMPTY>
<!ATTLIST write-memory
		        address CDATA   #REQUIRED
                        value   CDATA   #REQUIRED
                        bits    CDATA   #IMPLIED>
<!ELEMENT delay EMPTY>
<!ATTLIST delay
		        time CDATA   #REQUIRED>
<!ELEMENT wait-until-memory-equal EMPTY>
<!ATTLIST wait-until-memory-equal
		        address CDATA   #REQUIRED
                        value   CDATA   #REQUIRED
                        timeout CDATA   #IMPLIED
                        bits    CDATA   #IMPLIED>
<!ELEMENT wait-until-memory-not-equal EMPTY>
<!ATTLIST wait-until-memory-not-equal
		        address CDATA   #REQUIRED
                        value   CDATA   #REQUIRED
                        timeout CDATA   #IMPLIED
                        bits    CDATA   #IMPLIED>

<!ELEMENT memory-map (memory-device)*>
<!ELEMENT memory-device (property*, description?, sectors*)>
<!ATTLIST memory-device
                        address CDATA   #REQUIRED
		        size    CDATA   #REQUIRED
		        type    CDATA   #REQUIRED
                        device  CDATA   #IMPLIED>

<!ELEMENT description (#PCDATA)>
<!ELEMENT property (#PCDATA)>
<!ATTLIST property name CDATA #REQUIRED>
<!ELEMENT sectors EMPTY>
<!ATTLIST sectors
	size CDATA #REQUIRED
	count CDATA #REQUIRED>

<!-- Definition of default option values for each debug interface -->
<!ELEMENT debuggerDefaults (debugInterface*)>
<!ELEMENT debugInterface (option*)>
<!ATTLIST debugInterface 
	name CDATA #REQUIRED
>
<!ELEMENT option EMPTY>
<!ATTLIST option 
	name CDATA #REQUIRED
	defaultValue CDATA #REQUIRED
>

<!ENTITY % gdbtarget SYSTEM "gdb-target.dtd">
%gdbtarget;
